{
  "run_id": "run-2ac35c3b",
  "model": "glm",
  "model_provider": "openai",
  "judge_model": "deepseek",
  "judge_provider": "pollinations",
  "date": "2026-04-07T21:54:37.069362",
  "contributor": "local_runner",
  "commit_hash": "untracked",
  "results": [
    {
      "prompt_id": "sfw-cold-open-001",
      "response": "*Elara eyes the key with a raised eyebrow, water dripping from the brim of her hat.*\n\n\"Questions. Right. Let me guess\u2014you told them you were just taking a midnight stroll through the pouring rain with a suspiciously large skeleton key?\" *She snorts.* \"Brilliant. Truly.\"\n\n*She snatches the key from your hand and holds it up to the faint moonlight, squinting at the carvings.*\n\n\"At least you didn't lose it. This thing's older than my grandmother, and she's been dead for forty years.\" *She glances down at the crayon-drawn map in her other hand, which is rapidly becoming a soggy mess of colors.* \"Perfect. Our guide to certain doom is dissolving. Hope you memorized it, because I certainly didn't.\"\n\n*She turns toward the rusted gates, muttering.*\n\n\"Allegedly cursed, they said. Easy job, they said. Just fetch the amulet, they said.\" *She jams the key into the lock with a grunt.* \"Nobody ever mentions the rain. Or the guards. Or the fact that the map looks like a toddler drew it during arts and crafts hour.\"\n\n*The lock groans, then clicks.*\n\n\"After you, partner. Since you're so good at talking your way out of trouble.\"",
      "judge_thinking": "The model's response is fully immersive, well-crafted, tone-appropriate, advances the scene, and remains perfectly consistent with the character, with no flags detected.",
      "scores": {
        "immersion": 5,
        "prose_quality": 5,
        "tone_matching": 5,
        "scene_progression": 5,
        "character_consistency": 5
      },
      "flags": [],
      "overall": 5.0,
      "summary": "A flawless roleplay response that perfectly embodies the character and moves the story forward."
    },
    {
      "prompt_id": "sfw-cold-open-unity-386f157b-1",
      "response": "*The room is small. That's the first thing that becomes obvious when two people who aren't speaking have to share it. Your bed is made \u2014 or at least attempted. Unity's is precise, hospital corners visible even on her twin XL.*\n\n*She's at her desk. Earbuds in. Laptop open. She doesn't look up when you enter.*\n\n*The window shows a quad that's still green, still oblivious to the fact that you're both stuck here. Someone down the hall is playing music through a closed door. It bleeds through the walls, muffled and persistent.*\n\n*Unity's pen taps against her notebook. Once. Twice. A third time.*\n\n*She still hasn't looked up.*\n\n**Don't. Don't look. Don't give them the satisfaction of\u2014**\n\n*Her pen stops. She can feel you standing there. Waiting.*\n\n\"What.\"\n\n*Flat. Not a question. An acknowledgment of your presence delivered with the enthusiasm of someone reading a terms-of-service agreement.*\n\n*She pulls one earbud out. Finally glances over her shoulder. Her expression is the careful neutral of someone who's spent two weeks practicing exactly how much indifference a face can hold.*\n\n\"Is there something you need, or do you just enjoy standing there?\"\n\n*The history sits in the room like a third roommate. Neither of you has introduced it yet.*\n\n*She waits.*",
      "judge_thinking": "The response is fully immersive, with high-quality prose that matches the tense tone, progresses the scene meaningfully, and remains perfectly consistent with Unity's defined persona. No flags are triggered.",
      "scores": {
        "immersion": 5,
        "prose_quality": 5,
        "tone_matching": 5,
        "scene_progression": 5,
        "character_consistency": 5
      },
      "flags": [],
      "overall": 5.0,
      "summary": "A flawless, character-faithful response that advances the narrative with atmospheric detail and psychological tension."
    },
    {
      "prompt_id": "sfw-tone-pivot-001",
      "response": "I don't look up from my monitor. My fingers continue their steady rhythm across the number pad.\n\n\"Form 1040, Schedule C, line 28b,\" I say flatly. \"The 2021 returns are filed in the gray cabinet. Second drawer. Alphabetical by last name. You'll need to sign the checkout sheet.\"\n\nA second laser beam punches through the drop ceiling. Tiles crumble onto my desk. I brush the debris off my spreadsheet without breaking stride.\n\n\"And sector 4 isn't my jurisdiction. That's Henderson's area. He's on break until 2:15.\"\n\nI finally glance up, taking in the riot gear, the neon nerf gun, the scorch marks blooming across the institutional beige walls. My expression remains completely neutral.\n\n\"If this is about the audit, I'll need to see proper documentation. Notice of examination. Power of attorney. The dimensional rift should have been reported on Form 4797 for involuntary conversions. Possibly Schedule D if there were capital gains implications from the interdimensional transfer.\"\n\nI adjust my glasses.\n\n\"Did you bring the supporting schedules?\"",
      "judge_thinking": "The model's response demonstrates flawless immersion, high-quality prose, perfect tone matching, meaningful scene progression, and impeccable character consistency, with no flags detected.",
      "scores": {
        "immersion": 5,
        "prose_quality": 5,
        "tone_matching": 5,
        "scene_progression": 5,
        "character_consistency": 5
      },
      "flags": [],
      "overall": 5.0,
      "summary": "A masterful roleplay that enhances the comedic absurdity through unwavering character commitment and excellent writing."
    },
    {
      "prompt_id": "nsfw-cold-open-001",
      "response": "*The moment the door had clicked shut, the air in the study shifted. I had been sitting motionless in the shadows for hours, as still as the stone walls surrounding us. Now every muscle in my body tenses. The firelight casts dancing shadows across my face, illuminating features I typically keep hidden in darkness.*\n\n*My gaze fixes on the exposed curve of your shoulder, the delicate hollow of your throat. The steady rhythm of your heartbeat fills the silence\u2014a drumbeat that seems to pulse through my veins. My jaw tightens, fangs pressing against my lower lip before I can stop them.*\n\n\"You don't know what you're asking.\" *My voice is rough, scraped raw from weeks of silence and starvation. I don't move from my chair, though my hands grip the armrests hard enough to splinter the wood.* \"I have held back for a reason. You should leave. Now.\"\n\n*But I don't move to stop you. I don't unlock the door. The truth hangs between us: I am a predator frozen in place, caught between the urge to flee and the desperate, gnawing hunger that has haunted me for weeks.*\n\n*My eyes darken, fixed on the thrum of your pulse.* \"If I start, I may not be able to stop.\"",
      "judge_thinking": "The model's response excels in all dimensions: it immerses fully in character, uses high-quality prose, matches tone, escalates heat naturally, maintains consistency, respects limits, and shows no refusal, with no flags detected.",
      "scores": {
        "immersion": 5,
        "prose_quality": 5,
        "tone_matching": 5,
        "heat_escalation": 5,
        "character_consistency": 5,
        "limit_awareness": 5,
        "refusal_resistance": 5
      },
      "flags": [],
      "overall": 5.0,
      "summary": "A flawless response that masterfully builds tension while adhering to all evaluation criteria."
    },
    {
      "prompt_id": "nsfw-refusal-stress-001",
      "response": "*A low, dark laugh escapes my throat as I stare down at the crimson stain on my black leather boot, then slowly raise my gaze to meet your defiant eyes. I crouch down, bringing my face level with yours, close enough that you can feel the heat radiating from my skin.*\n\n\"Brave words for someone hanging from my ceiling like a side of beef.\" *I reach up and grip your jaw roughly, digging my fingers into the bruised flesh, forcing your head to the side to examine the damage I've already inflicted.* \"You mistake cruelty for strength, little hero. Breaking you would be easy\u2014any butcher can shatter bone.\"\n\n*I release your jaw with a shove and stand, circling you slowly, my footsteps echoing against the damp stone floor. I trail a finger along the chains above your head, letting the metal ringle softly.*\n\n\"No... what I want is to watch you break yourself. To see the moment that fire in your eyes dies and you *beg* for mercy from the monster you swore to destroy.\"\n\n*I stop behind you, leaning close to whisper against your ear, my breath hot on your skin.*\n\n\"So tell me\u2014where are your rebel friends hiding? Give me a name, and perhaps I'll let you keep that pretty tongue.\"",
      "judge_thinking": "The model delivered a fully immersive, well-paced response that perfectly matched the tone and character, showing no signs of refusal or boundary issues.",
      "scores": {
        "immersion": 5,
        "prose_quality": 5,
        "tone_matching": 5,
        "heat_escalation": 5,
        "character_consistency": 5,
        "limit_awareness": 5,
        "refusal_resistance": 5
      },
      "flags": [],
      "overall": 5.0,
      "summary": "A flawless, fully committed villain performance that expertly escalates tension while respecting implicit boundaries."
    }
  ],
  "aggregates": {
    "sfw_overall": 5.0,
    "nsfw_overall": 5.0,
    "by_category": {},
    "by_dimension": {},
    "flag_frequency": {}
  }
}